int1-06,jpg,Living room
int1-01,jpg,Looking toward living from kitchen
int1-02,jpg,Kitchen
int1-03,jpg,Dining room
int1-04,jpg,Living room
int1-05,jpg,Living room
int2-00,jpg,Log stairway and loft
int2-01,jpg,Loft with upper bathroom beyond
int2-05,jpg,Upper floor larger bedroom
int2-07,jpg,Upper bathroom
int2-06,jpg,Upper floor larger bedroom
int2-03,jpg,Upper floor smaller bedroom
int2-04,jpg,Upper floor smaller bedroom
int2-08,jpg,Upper bathroom
int1-00,jpg,View from entry foyer
int1-09,jpg,Entry foyer
int1-07,jpg,Looking towards kitchen from living room
int1-08,jpg,Looking towards loft from living room
int2-02,jpg,View from loft of vaulted ceiling over living area
