int_01,jpg,View of Great Room Fireplace
int_00,jpg,View of Great Room from Foyer
int_02,jpg,View of Great Room
int_03,jpg,View from Great Room towards Dining and Kitchen
int_04,jpg,View of Kitchen
int_05,jpg,View of Kitchen
int_06,jpg,View of Loft from Great Room
int_07,jpg,View of Master Bedroom
int_08,jpg,View from Master Bedroom towards Ensuite Bathroom
int_09,jpg,View of Master Ensuite Bathroom
int_11,jpg,View of Master Ensuite Bathroom
int_12,jpg,View of Log Stair from Foyer
int_13,jpg,View from Log Stair towards Loft
int_14,jpg,View along Loft Walkway
int_15,jpg,View of Loft Sitting Area
int_19,jpg,View of Loft Sitting Area
int_16,jpg,View of Party Room Right Wall
int_17,jpg,View of Party Room Front Wall
int_18,jpg,View of Party Room Rear Wall and Deck
int_21,jpg,View of Great Room from Upper Walkway
int_22,jpg,View of Upstairs Master Bedroom
int_23,jpg,View towards Upstairs Master Bedroom Ensuite and Closet
