0,jpg,Front right view 
1,jpg,Front left view
2,jpg,Left side view
3,jpg,Back left side view
4,jpg,Back view
5,jpg,Right side back view
6,jpg,Right side view
7,jpg,Right side view
8,jpg,Front side
9,jpg,French doors to front deck
10,jpg,Left side covered deck
11,jpg,Left side covered deck
12,jpg,Left side covered deck
13,jpg,Birds-eye view
20,jpg,Looking across living room to kitchen and dining room
23,jpg,Looking from kitchen to living room front wall
27,jpg,Looking from dining room into kitchen
30,jpg,Looking from loft to living room below
33,jpg,Master bedroom
21,jpg,Looking from stairs to dining room
24,jpg,Looking from dining room across living room
25,jpg,Looking from dining room across living room
34,jpg,Master bedroom sitting room
31,jpg,Master bedroom windows
