2,jpg,Front View
3,jpg,Front Left view
6,jpg,Rear (Entry) Side View
7,jpg,Rear (Entry) Side View
0,jpg,Right side view
2a,jpg,Front View
100,jpg,View from Foyer to Great Room
101,jpg,View from Foyer to Great Room
102,jpg,View from Great Room towards Kitchen
103,jpg,View of Loft walkway from Great Room
104,jpg,View of Great Room fireplace
105,jpg,View of Kitchen
106,jpg,View from Dining area towards Kitchen
107,jpg,View from Kitchen towards Dining Room
108,jpg,View of Great Room from Kitchen peninsula
110,jpg,View of main floor Master Ensuite
111,jpg,View of main floor Master Bedroom
112,jpg,View of main floor Master Bedroom
113,jpg,View looking up log stairway
114,jpg,Great Room vaulted ceiling from Loft
115,jpg,Loft walkway
116,jpg,Loft sitting area
117,jpg,View down into Great Room from Loft
118,jpg,Master Suite on Upper Floor
119,jpg,Master Suite on Upper Floor looking towards Ensuite
120,jpg,Upper Floor Master Suite fireplace and french doors to Balcony
123,jpg,Upper Floor front Bedroom
124,jpg,Upper Floor front Bedroom
125,jpg,Upper Floor back Bedroom
126,jpg,Upper Floor back Bedroom
127,jpg,Loft
128,jpg,Loft sitting area
